[
  {
    "lap": 1,
    "s1": 8.6,
    "s2": 12,
    "s3": 12.2,
    "total": 32.8,
    "delta_to_target_s": 1.159,
    "fuel_kg": 0.174,
    "wear_pct": 0.35,
    "alert_tier": null
  },
  {
    "lap": 2,
    "s1": 7.7,
    "s2": 12,
    "s3": 12.1,
    "total": 31.8,
    "delta_to_target_s": 0.159,
    "fuel_kg": 0.162,
    "wear_pct": 0.7,
    "alert_tier": "2c"
  },
  {
    "lap": 3,
    "s1": 7.7,
    "s2": 12,
    "s3": 12.1,
    "total": 31.8,
    "delta_to_target_s": 0.159,
    "fuel_kg": 0.163,
    "wear_pct": 1.04,
    "alert_tier": null
  },
  {
    "lap": 4,
    "s1": 7.7,
    "s2": 12,
    "s3": 12.1,
    "total": 31.8,
    "delta_to_target_s": 0.159,
    "fuel_kg": 0.163,
    "wear_pct": 1.39,
    "alert_tier": null
  },
  {
    "lap": 5,
    "s1": 7.7,
    "s2": 12,
    "s3": 12.1,
    "total": 31.8,
    "delta_to_target_s": 0.159,
    "fuel_kg": 0.164,
    "wear_pct": 1.73,
    "alert_tier": "2c"
  },
  {
    "lap": 6,
    "s1": 7.7,
    "s2": 12,
    "s3": 12.1,
    "total": 31.8,
    "delta_to_target_s": 0.159,
    "fuel_kg": 0.164,
    "wear_pct": 2.08,
    "alert_tier": null
  },
  {
    "lap": 7,
    "s1": 7.7,
    "s2": 12,
    "s3": 12.1,
    "total": 31.8,
    "delta_to_target_s": 0.159,
    "fuel_kg": 0.164,
    "wear_pct": 2.42,
    "alert_tier": null
  },
  {
    "lap": 8,
    "s1": 7.7,
    "s2": 12,
    "s3": 12.1,
    "total": 31.8,
    "delta_to_target_s": 0.159,
    "fuel_kg": 0.163,
    "wear_pct": 2.76,
    "alert_tier": "2c"
  },
  {
    "lap": 9,
    "s1": 7.7,
    "s2": 12,
    "s3": 12.1,
    "total": 31.8,
    "delta_to_target_s": 0.159,
    "fuel_kg": 0.162,
    "wear_pct": 3.1,
    "alert_tier": null
  },
  {
    "lap": 10,
    "s1": 7.7,
    "s2": 12,
    "s3": 12.1,
    "total": 31.8,
    "delta_to_target_s": 0.159,
    "fuel_kg": 0.161,
    "wear_pct": 3.44,
    "alert_tier": "2a"
  },
  {
    "lap": 11,
    "s1": 7.7,
    "s2": 12,
    "s3": 12.1,
    "total": 31.8,
    "delta_to_target_s": 0.159,
    "fuel_kg": 0.16,
    "wear_pct": 3.78,
    "alert_tier": null
  },
  {
    "lap": 12,
    "s1": 7.7,
    "s2": 12,
    "s3": 12.1,
    "total": 31.8,
    "delta_to_target_s": 0.159,
    "fuel_kg": 0.159,
    "wear_pct": 4.11,
    "alert_tier": null
  },
  {
    "lap": 13,
    "s1": 7.7,
    "s2": 12,
    "s3": 12.1,
    "total": 31.8,
    "delta_to_target_s": 0.159,
    "fuel_kg": 0.159,
    "wear_pct": 4.44,
    "alert_tier": "2c"
  },
  {
    "lap": 14,
    "s1": 7.7,
    "s2": 12,
    "s3": 12.1,
    "total": 31.8,
    "delta_to_target_s": 0.159,
    "fuel_kg": 0.158,
    "wear_pct": 4.77,
    "alert_tier": "2b"
  },
  {
    "lap": 15,
    "s1": 7.7,
    "s2": 12,
    "s3": 12.1,
    "total": 31.8,
    "delta_to_target_s": 0.159,
    "fuel_kg": 0.158,
    "wear_pct": 5.1,
    "alert_tier": "2a"
  },
  {
    "lap": 16,
    "s1": 7.7,
    "s2": 12,
    "s3": 12.1,
    "total": 31.8,
    "delta_to_target_s": 0.159,
    "fuel_kg": 0.158,
    "wear_pct": 5.43,
    "alert_tier": null
  },
  {
    "lap": 17,
    "s1": 7.7,
    "s2": 12,
    "s3": 12.1,
    "total": 31.8,
    "delta_to_target_s": 0.159,
    "fuel_kg": 0.159,
    "wear_pct": 5.76,
    "alert_tier": "2c"
  },
  {
    "lap": 18,
    "s1": 7.7,
    "s2": 12,
    "s3": 12.1,
    "total": 31.8,
    "delta_to_target_s": 0.159,
    "fuel_kg": 0.16,
    "wear_pct": 6.09,
    "alert_tier": null
  },
  {
    "lap": 19,
    "s1": 7.7,
    "s2": 12,
    "s3": 12.1,
    "total": 31.8,
    "delta_to_target_s": 0.159,
    "fuel_kg": 0.161,
    "wear_pct": 6.41,
    "alert_tier": null
  },
  {
    "lap": 20,
    "s1": 7.7,
    "s2": 12,
    "s3": 12.1,
    "total": 31.8,
    "delta_to_target_s": 0.159,
    "fuel_kg": 0.162,
    "wear_pct": 6.74,
    "alert_tier": "2c"
  },
  {
    "lap": 21,
    "s1": 7.7,
    "s2": 12,
    "s3": 12.1,
    "total": 31.8,
    "delta_to_target_s": 0.159,
    "fuel_kg": 0.163,
    "wear_pct": 7.07,
    "alert_tier": null
  },
  {
    "lap": 22,
    "s1": 7.7,
    "s2": 12,
    "s3": 12.1,
    "total": 31.8,
    "delta_to_target_s": 0.159,
    "fuel_kg": 0.164,
    "wear_pct": 7.4,
    "alert_tier": null
  },
  {
    "lap": 23,
    "s1": 7.7,
    "s2": 12,
    "s3": 12.1,
    "total": 31.8,
    "delta_to_target_s": 0.159,
    "fuel_kg": 0.164,
    "wear_pct": 7.73,
    "alert_tier": null
  },
  {
    "lap": 24,
    "s1": 7.7,
    "s2": 12,
    "s3": 12.1,
    "total": 31.8,
    "delta_to_target_s": 0.159,
    "fuel_kg": 0.164,
    "wear_pct": 8.07,
    "alert_tier": "2c"
  },
  {
    "lap": 25,
    "s1": 7.7,
    "s2": 12,
    "s3": 12.1,
    "total": 31.8,
    "delta_to_target_s": 0.159,
    "fuel_kg": 0.164,
    "wear_pct": 8.4,
    "alert_tier": "2a"
  },
  {
    "lap": 26,
    "s1": 7.7,
    "s2": 12,
    "s3": 12.1,
    "total": 31.8,
    "delta_to_target_s": 0.159,
    "fuel_kg": 0.164,
    "wear_pct": 8.74,
    "alert_tier": "2b"
  },
  {
    "lap": 27,
    "s1": 7.7,
    "s2": 12,
    "s3": 12.1,
    "total": 31.8,
    "delta_to_target_s": 0.159,
    "fuel_kg": 0.163,
    "wear_pct": 9.08,
    "alert_tier": null
  },
  {
    "lap": 28,
    "s1": 7.7,
    "s2": 12,
    "s3": 12.1,
    "total": 31.8,
    "delta_to_target_s": 0.159,
    "fuel_kg": 0.162,
    "wear_pct": 9.42,
    "alert_tier": "2c"
  },
  {
    "lap": 29,
    "s1": 7.7,
    "s2": 12,
    "s3": 12.1,
    "total": 31.8,
    "delta_to_target_s": 0.159,
    "fuel_kg": 0.161,
    "wear_pct": 9.77,
    "alert_tier": null
  },
  {
    "lap": 30,
    "s1": 7.7,
    "s2": 12,
    "s3": 12.1,
    "total": 31.8,
    "delta_to_target_s": 0.159,
    "fuel_kg": 0.16,
    "wear_pct": 10.11,
    "alert_tier": "2a"
  },
  {
    "lap": 31,
    "s1": 7.7,
    "s2": 12,
    "s3": 12.1,
    "total": 31.8,
    "delta_to_target_s": 0.159,
    "fuel_kg": 0.159,
    "wear_pct": 10.46,
    "alert_tier": null
  },
  {
    "lap": 32,
    "s1": 7.7,
    "s2": 12,
    "s3": 12.1,
    "total": 31.8,
    "delta_to_target_s": 0.159,
    "fuel_kg": 0.158,
    "wear_pct": 10.8,
    "alert_tier": "2b"
  },
  {
    "lap": 33,
    "s1": 7.7,
    "s2": 12,
    "s3": 12.1,
    "total": 31.8,
    "delta_to_target_s": 0.159,
    "fuel_kg": 0.158,
    "wear_pct": 11.15,
    "alert_tier": "2c"
  },
  {
    "lap": 34,
    "s1": 7.7,
    "s2": 12,
    "s3": 12.1,
    "total": 31.8,
    "delta_to_target_s": 0.159,
    "fuel_kg": 0.158,
    "wear_pct": 11.5,
    "alert_tier": null
  },
  {
    "lap": 35,
    "s1": 7.7,
    "s2": 12,
    "s3": 12.1,
    "total": 31.8,
    "delta_to_target_s": 0.159,
    "fuel_kg": 0.159,
    "wear_pct": 11.84,
    "alert_tier": "2a"
  },
  {
    "lap": 36,
    "s1": 7.7,
    "s2": 12,
    "s3": 12.1,
    "total": 31.8,
    "delta_to_target_s": 0.159,
    "fuel_kg": 0.159,
    "wear_pct": 12.19,
    "alert_tier": "2c"
  },
  {
    "lap": 37,
    "s1": 7.7,
    "s2": 12,
    "s3": 12.1,
    "total": 31.8,
    "delta_to_target_s": 0.159,
    "fuel_kg": 0.16,
    "wear_pct": 12.53,
    "alert_tier": null
  },
  {
    "lap": 38,
    "s1": 7.7,
    "s2": 12,
    "s3": 12.1,
    "total": 31.8,
    "delta_to_target_s": 0.159,
    "fuel_kg": 0.161,
    "wear_pct": 12.87,
    "alert_tier": "2b"
  },
  {
    "lap": 39,
    "s1": 7.7,
    "s2": 12,
    "s3": 12.1,
    "total": 31.8,
    "delta_to_target_s": 0.159,
    "fuel_kg": 0.162,
    "wear_pct": 13.21,
    "alert_tier": "2c"
  },
  {
    "lap": 40,
    "s1": 7.7,
    "s2": 12,
    "s3": 12.1,
    "total": 31.8,
    "delta_to_target_s": 0.159,
    "fuel_kg": 0.163,
    "wear_pct": 13.55,
    "alert_tier": "2a"
  },
  {
    "lap": 41,
    "s1": 7.7,
    "s2": 12,
    "s3": 12.1,
    "total": 31.8,
    "delta_to_target_s": 0.159,
    "fuel_kg": 0.164,
    "wear_pct": 13.88,
    "alert_tier": null
  },
  {
    "lap": 42,
    "s1": 7.7,
    "s2": 12,
    "s3": 12.1,
    "total": 31.8,
    "delta_to_target_s": 0.159,
    "fuel_kg": 0.164,
    "wear_pct": 14.21,
    "alert_tier": null
  },
  {
    "lap": 43,
    "s1": 7.7,
    "s2": 12,
    "s3": 12.1,
    "total": 31.8,
    "delta_to_target_s": 0.159,
    "fuel_kg": 0.164,
    "wear_pct": 14.55,
    "alert_tier": "2c"
  },
  {
    "lap": 44,
    "s1": 7.7,
    "s2": 12,
    "s3": 12.1,
    "total": 31.8,
    "delta_to_target_s": 0.159,
    "fuel_kg": 0.164,
    "wear_pct": 14.88,
    "alert_tier": "2b"
  },
  {
    "lap": 45,
    "s1": 7.7,
    "s2": 12,
    "s3": 12.1,
    "total": 31.8,
    "delta_to_target_s": 0.159,
    "fuel_kg": 0.163,
    "wear_pct": 15.21,
    "alert_tier": "2a"
  },
  {
    "lap": 46,
    "s1": 7.7,
    "s2": 12,
    "s3": 12.1,
    "total": 31.8,
    "delta_to_target_s": 0.159,
    "fuel_kg": 0.163,
    "wear_pct": 15.53,
    "alert_tier": null
  },
  {
    "lap": 47,
    "s1": 7.7,
    "s2": 12,
    "s3": 12.1,
    "total": 31.8,
    "delta_to_target_s": 0.159,
    "fuel_kg": 0.162,
    "wear_pct": 15.86,
    "alert_tier": null
  },
  {
    "lap": 48,
    "s1": 7.7,
    "s2": 12,
    "s3": 12.1,
    "total": 31.8,
    "delta_to_target_s": 0.159,
    "fuel_kg": 0.161,
    "wear_pct": 16.19,
    "alert_tier": "2c"
  },
  {
    "lap": 49,
    "s1": 7.7,
    "s2": 12,
    "s3": 12.1,
    "total": 31.8,
    "delta_to_target_s": 0.159,
    "fuel_kg": 0.16,
    "wear_pct": 16.52,
    "alert_tier": null
  },
  {
    "lap": 50,
    "s1": 7.7,
    "s2": 12,
    "s3": 12.1,
    "total": 31.8,
    "delta_to_target_s": 0.159,
    "fuel_kg": 0.159,
    "wear_pct": 16.84,
    "alert_tier": "2b"
  },
  {
    "lap": 51,
    "s1": 7.7,
    "s2": 12,
    "s3": 12.1,
    "total": 31.8,
    "delta_to_target_s": 0.159,
    "fuel_kg": 0.158,
    "wear_pct": 17.17,
    "alert_tier": "2c"
  },
  {
    "lap": 52,
    "s1": 7.7,
    "s2": 12,
    "s3": 12.1,
    "total": 31.8,
    "delta_to_target_s": 0.159,
    "fuel_kg": 0.158,
    "wear_pct": 17.51,
    "alert_tier": null
  },
  {
    "lap": 53,
    "s1": 7.7,
    "s2": 12,
    "s3": 12.1,
    "total": 31.8,
    "delta_to_target_s": 0.159,
    "fuel_kg": 0.158,
    "wear_pct": 17.84,
    "alert_tier": null
  },
  {
    "lap": 54,
    "s1": 7.7,
    "s2": 12,
    "s3": 12.1,
    "total": 31.8,